{
 "about": "Every sea's real name (game proposal 0047): Natural Earth's marine areas (ne_10m_geography_marine_polys, public domain), keyed by the English name as an id. en is Natural Earth's English name; fi is the Wikidata item's Finnish label (the item Natural Earth names), left out where Wikidata has none, and then the game shows the English. The tile maker names an open-sea tile after the marine area at its centre (ne_ids); a cell no marine area covers isn't made.",
 "source": "naturalearth:ne_10m_geography_marine_polys:5.1.2",
 "fi_source": "wikidata:labels:2026-10-31",
 "seas": {
  "adriatic_sea": {
   "en": "Adriatic Sea",
   "ne_ids": [
    1159116607
   ],
   "kind": "sea",
   "wikidata": "Q13924",
   "fi": "Adrianmeri"
  },
  "aegean_sea": {
   "en": "Aegean Sea",
   "ne_ids": [
    1159117123
   ],
   "kind": "sea",
   "wikidata": "Q34575",
   "fi": "Egeanmeri"
  },
  "albemarle_sound": {
   "en": "Albemarle Sound",
   "ne_ids": [
    1159119313
   ],
   "kind": "sound",
   "wikidata": "Q1441345"
  },
  "alboran_sea": {
   "en": "Alboran Sea",
   "ne_ids": [
    1159118457
   ],
   "kind": "sea",
   "wikidata": "Q199408",
   "fi": "Alboráninmeri"
  },
  "amazon": {
   "en": "Amazon",
   "ne_ids": [
    1159119967
   ],
   "kind": "river",
   "wikidata": "Q3783",
   "fi": "Amazon"
  },
  "amundsen_gulf": {
   "en": "Amundsen Gulf",
   "ne_ids": [
    1159117223
   ],
   "kind": "gulf",
   "wikidata": "Q1974744",
   "fi": "Amundseninlahti"
  },
  "amundsen_sea": {
   "en": "Amundsen Sea",
   "ne_ids": [
    1159116181
   ],
   "kind": "sea",
   "wikidata": "Q72154",
   "fi": "Amundseninmeri"
  },
  "andaman_sea": {
   "en": "Andaman Sea",
   "ne_ids": [
    1159115987
   ],
   "kind": "sea",
   "wikidata": "Q47632",
   "fi": "Andamaanienmeri"
  },
  "antongil_bay": {
   "en": "Antongil Bay",
   "ne_ids": [
    1159118761
   ],
   "kind": "bay",
   "wikidata": "Q803725"
  },
  "arabian_sea": {
   "en": "Arabian Sea",
   "ne_ids": [
    1159115343
   ],
   "kind": "sea",
   "wikidata": "Q58705",
   "fi": "Arabianmeri"
  },
  "arafura_sea": {
   "en": "Arafura Sea",
   "ne_ids": [
    1159116081
   ],
   "kind": "sea",
   "wikidata": "Q128880",
   "fi": "Arafuranmeri"
  },
  "arctic_ocean": {
   "en": "Arctic Ocean",
   "ne_ids": [
    1159115017
   ],
   "kind": "ocean",
   "wikidata": "Q788",
   "fi": "Pohjoinen jäämeri"
  },
  "atlantic_ocean": {
   "en": "Atlantic Ocean",
   "ne_ids": [
    1159115057,
    1159115149
   ],
   "kind": "ocean",
   "wikidata": "Q97",
   "fi": "Atlantin valtameri"
  },
  "bab_el_mandeb": {
   "en": "Bab-el-Mandeb",
   "ne_ids": [
    1159118853
   ],
   "kind": "strait",
   "wikidata": "Q83318",
   "fi": "Bab el Mandeb"
  },
  "baffin_bay": {
   "en": "Baffin Bay",
   "ne_ids": [
    1159115483
   ],
   "kind": "bay",
   "wikidata": "Q37040",
   "fi": "Baffininlahti"
  },
  "bahia_blanca": {
   "en": "Bahía Blanca",
   "ne_ids": [
    1159118573
   ],
   "kind": "bay"
  },
  "bahia_grande": {
   "en": "Bahía Grande",
   "ne_ids": [
    1159118629
   ],
   "kind": "bay"
  },
  "baia_de_sao_marcos": {
   "en": "Baía de São Marcos",
   "ne_ids": [
    1159117597
   ],
   "kind": "bay",
   "wikidata": "Q2060432"
  },
  "baird_inlet": {
   "en": "Baird Inlet",
   "ne_ids": [
    1159119417
   ],
   "kind": "inlet",
   "wikidata": "Q4848613"
  },
  "balearic_sea": {
   "en": "Balearic Sea",
   "ne_ids": [
    1159117105
   ],
   "kind": "sea",
   "wikidata": "Q200712",
   "fi": "Baleaarienmeri"
  },
  "bali_sea": {
   "en": "Bali Sea",
   "ne_ids": [
    1159120073
   ],
   "kind": "sea",
   "wikidata": "Q277014",
   "fi": "Balinmeri"
  },
  "bali_strait": {
   "en": "Bali Strait",
   "ne_ids": [
    1159120135
   ],
   "kind": "strait",
   "wikidata": "Q604492",
   "fi": "Balinsalmi"
  },
  "baltic_sea": {
   "en": "Baltic Sea",
   "ne_ids": [
    1159115831
   ],
   "kind": "sea",
   "wikidata": "Q545",
   "fi": "Itämeri"
  },
  "banda_sea": {
   "en": "Banda Sea",
   "ne_ids": [
    1159115717
   ],
   "kind": "sea",
   "wikidata": "Q171510",
   "fi": "Bandanmeri"
  },
  "barents_sea": {
   "en": "Barents Sea",
   "ne_ids": [
    1159115861
   ],
   "kind": "sea",
   "wikidata": "Q45823",
   "fi": "Barentsinmeri"
  },
  "bass_strait": {
   "en": "Bass Strait",
   "ne_ids": [
    1159117373
   ],
   "kind": "strait",
   "wikidata": "Q171846",
   "fi": "Bassinsalmi"
  },
  "bathurst_inlet": {
   "en": "Bathurst Inlet",
   "ne_ids": [
    1159119669
   ],
   "kind": "bay",
   "wikidata": "Q810805"
  },
  "bay_of_bengal": {
   "en": "Bay of Bengal",
   "ne_ids": [
    1159115253
   ],
   "kind": "bay",
   "wikidata": "Q38684",
   "fi": "Bengalinlahti"
  },
  "bay_of_biscay": {
   "en": "Bay of Biscay",
   "ne_ids": [
    1159115749
   ],
   "kind": "bay",
   "wikidata": "Q41573",
   "fi": "Biskajanlahti"
  },
  "bay_of_campeche": {
   "en": "Bay of Campeche",
   "ne_ids": [
    1159116059
   ],
   "kind": "bay",
   "wikidata": "Q61304"
  },
  "bay_of_fundy": {
   "en": "Bay of Fundy",
   "ne_ids": [
    1159116797
   ],
   "kind": "bay",
   "wikidata": "Q181857",
   "fi": "Fundynlahti"
  },
  "bay_of_mecklenburg": {
   "en": "Bay of Mecklenburg",
   "ne_ids": [
    1159120643
   ],
   "kind": "bay",
   "wikidata": "Q317006",
   "fi": "Mecklenburginlahti"
  },
  "bay_of_plenty": {
   "en": "Bay of Plenty",
   "ne_ids": [
    1159116643
   ],
   "kind": "bay",
   "wikidata": "Q140290"
  },
  "beaufort_sea": {
   "en": "Beaufort Sea",
   "ne_ids": [
    1159115359
   ],
   "kind": "sea",
   "wikidata": "Q131274",
   "fi": "Beaufortinmeri"
  },
  "bellingshausen_sea": {
   "en": "Bellingshausen Sea",
   "ne_ids": [
    1159116169
   ],
   "kind": "sea",
   "wikidata": "Q183455",
   "fi": "Bellingshauseninmeri"
  },
  "bering_sea": {
   "en": "Bering Sea",
   "ne_ids": [
    1159117319
   ],
   "kind": "sea",
   "wikidata": "Q44725",
   "fi": "Beringinmeri"
  },
  "bight_of_benin": {
   "en": "Bight of Benin",
   "ne_ids": [
    1159118475
   ],
   "kind": "bay",
   "wikidata": "Q47530",
   "fi": "Benininlahti"
  },
  "bight_of_biafra": {
   "en": "Bight of Biafra",
   "ne_ids": [
    1159118493
   ],
   "kind": "bay",
   "wikidata": "Q999031",
   "fi": "Bonnynlahti"
  },
  "bismarck_sea": {
   "en": "Bismarck Sea",
   "ne_ids": [
    1159116735
   ],
   "kind": "sea",
   "wikidata": "Q199436",
   "fi": "Bismarckinmeri"
  },
  "black_sea": {
   "en": "Black Sea",
   "ne_ids": [
    1159115171
   ],
   "kind": "sea",
   "wikidata": "Q166",
   "fi": "Mustameri"
  },
  "boca_grande": {
   "en": "Boca Grande",
   "ne_ids": [
    1159117445
   ],
   "kind": "bay"
  },
  "bohai_sea": {
   "en": "Bohai Sea",
   "ne_ids": [
    1159117171
   ],
   "kind": "sea",
   "wikidata": "Q181969",
   "fi": "Bohainmeri"
  },
  "bohol_sea": {
   "en": "Bohol Sea",
   "ne_ids": [
    1159120253
   ],
   "kind": "sea",
   "wikidata": "Q242326"
  },
  "boknafjord": {
   "en": "Boknafjord",
   "ne_ids": [
    1159118943
   ],
   "kind": "fjord",
   "wikidata": "Q225004",
   "fi": "Boknavuono"
  },
  "bosporus": {
   "en": "Bosporus",
   "ne_ids": [
    1159118835
   ],
   "kind": "strait",
   "wikidata": "Q35958",
   "fi": "Bosporinsalmi"
  },
  "bransfield_strait": {
   "en": "Bransfield Strait",
   "ne_ids": [
    1159117561
   ],
   "kind": "strait",
   "wikidata": "Q898839",
   "fi": "Bransfieldinsalmi"
  },
  "bras_d_or_lake": {
   "en": "Bras d'Or Lake",
   "ne_ids": [
    1159119983
   ],
   "kind": "lagoon",
   "wikidata": "Q898989"
  },
  "bristol_bay": {
   "en": "Bristol Bay",
   "ne_ids": [
    1159116991
   ],
   "kind": "bay",
   "wikidata": "Q917872",
   "fi": "Bristolinlahti"
  },
  "bristol_channel": {
   "en": "Bristol Channel",
   "ne_ids": [
    1159115891
   ],
   "kind": "channel",
   "wikidata": "Q188203",
   "fi": "Bristolin kanaali"
  },
  "buli_bay": {
   "en": "Buli Bay",
   "ne_ids": [
    1159120217
   ],
   "kind": "gulf"
  },
  "canal_do_norte": {
   "en": "Canal do Norte",
   "ne_ids": [
    1159120591
   ],
   "kind": "channel"
  },
  "canal_do_sul": {
   "en": "Canal do Sul",
   "ne_ids": [
    1159120573
   ],
   "kind": "channel"
  },
  "canal_perigoso": {
   "en": "Canal Perigoso",
   "ne_ids": [
    1159120555
   ],
   "kind": "channel"
  },
  "caribbean_sea": {
   "en": "Caribbean Sea",
   "ne_ids": [
    1159115379
   ],
   "kind": "sea",
   "wikidata": "Q1247",
   "fi": "Karibianmeri"
  },
  "caspian_sea": {
   "en": "Caspian Sea",
   "ne_ids": [
    1159115461
   ],
   "kind": "sea",
   "wikidata": "Q5484",
   "fi": "Kaspianmeri"
  },
  "celebes_sea": {
   "en": "Celebes Sea",
   "ne_ids": [
    1159115635
   ],
   "kind": "sea",
   "wikidata": "Q19270",
   "fi": "Celebesinmeri"
  },
  "ceram_sea": {
   "en": "Ceram Sea",
   "ne_ids": [
    1159116897
   ],
   "kind": "sea",
   "wikidata": "Q210855",
   "fi": "Seraminmeri"
  },
  "chaunskaya_bay": {
   "en": "Chaunskaya Bay",
   "ne_ids": [
    1159119047
   ],
   "kind": "bay",
   "wikidata": "Q915250",
   "fi": "Tšauninlahti"
  },
  "chesapeake_bay": {
   "en": "Chesapeake Bay",
   "ne_ids": [
    1159117043
   ],
   "kind": "bay",
   "wikidata": "Q216868",
   "fi": "Chesapeakenlahti"
  },
  "chukchi_sea": {
   "en": "Chukchi Sea",
   "ne_ids": [
    1159116037
   ],
   "kind": "sea",
   "wikidata": "Q159252",
   "fi": "Tšuktšimeri"
  },
  "columbia_river": {
   "en": "Columbia River",
   "ne_ids": [
    1159120745
   ],
   "kind": "river",
   "wikidata": "Q2251",
   "fi": "Columbia"
  },
  "cook_strait": {
   "en": "Cook Strait",
   "ne_ids": [
    1159118281
   ],
   "kind": "strait",
   "wikidata": "Q5023",
   "fi": "Cookinsalmi"
  },
  "coral_sea": {
   "en": "Coral Sea",
   "ne_ids": [
    1159115219
   ],
   "kind": "sea",
   "wikidata": "Q82931",
   "fi": "Korallimeri"
  },
  "cordova_bay": {
   "en": "Cordova Bay",
   "ne_ids": [
    1159120451
   ],
   "kind": "bay",
   "wikidata": "Q5170043"
  },
  "cumberland_sound": {
   "en": "Cumberland Sound",
   "ne_ids": [
    1159117615
   ],